{
  "plan_id": "implementation-plan-example",
  "task_id": "task-example",
  "created_at": "2024-01-01T00:00:00Z",
  "planner_role": "clean-architect",
  "implementation_root_refs": [
    "CLEAN_ROOM_IMPLEMENTATION_ROOTS[0]"
  ],
  "source_artifacts": [
    "behavior-spec.json",
    "skeleton-manifest.json"
  ],
  "foundation_summary": "Example clean implementation foundation is available through the configured implementation root.",
  "work_items": [
    {
      "work_item_id": "work-example-flow",
      "status": "planned",
      "summary": "Implement the example observable flow.",
      "spec_ids": [
        "spec-example-flow"
      ],
      "public_contract_refs": [],
      "implementation_root_ref": "CLEAN_ROOM_IMPLEMENTATION_ROOTS[0]",
      "target_paths": [
        "src/example-flow.js"
      ],
      "test_paths": [
        "test/example-flow.test.js"
      ],
      "local_patterns": [
        "Follow existing destination project test naming and module boundaries."
      ],
      "constraints": [
        "Do not use source-derived names or source-shaped pseudocode."
      ],
      "risks": [],
      "verification_commands": [
        {
          "command": [
            "npm",
            "test"
          ],
          "cwd": "CLEAN_ROOM_IMPLEMENTATION_ROOTS[0]",
          "purpose": "Run destination project tests."
        }
      ],
      "acceptance_criteria": [
        "The behavior in spec-example-flow is implemented and covered by a destination test."
      ]
    }
  ],
  "verification_strategy": [
    {
      "command": [
        "npm",
        "test"
      ],
      "cwd": "CLEAN_ROOM_IMPLEMENTATION_ROOTS[0]",
      "purpose": "Verify the clean implementation."
    }
  ],
  "implementation_forbidden_material": [
    "source_excerpt",
    "raw_diff",
    "private_identifier",
    "source_shaped_pseudocode"
  ],
  "open_decisions": []
}
